"uuid";"lang";"year";"concepts";"design";"comments";"codeswitch"
"5ca175fbcc033";"1";"Senior";"I did not realize that I was supposed to change the ""return null"" rather than try to print the table. The concepts seemed to be straightforward. ";"I was not able to use comments correctly. I thought * designated a comment, but I continued to get errors with this. ";;"I did not feel like I had to switch between languages, and not having to switch allowed me to learn what to do throughout the tasks."
"5ca17ba35f780";"2";"Junior";"The concepts themselves were straight forward. Simple SQL mainly, for a little while I forgot that there were 'OR's as well as 'AND's but that sorted itself out. Some of the syntax required for the sql libraries gave me trouble though.  ";"In the SQL question where it was required to join two tables together, I do not think it makes much sense as to why you need to include the other table's name along with the name of the query you want to execute. They do not seem to be all that related. i.e. .Search(queryName,joinedTableName) ";"I was not able to figure out why I was getting errors when trying to insert a record into a table. The SQL was maddeningly easy and it was quite frustrating going round and round with limited debugging information for 30 minutes. ";"No, I do not feel as if I had to switch languages. At my internship the common coding language is C# and while I never worked in Java before the two languages have their ties. It was relatively easy to get up to speed."
"5ca188a4d46b2";"3";"Junior";"I had trouble finding the .And() method because my initial thought was to make two tables and combine them. ";"No, I love Java";"Why is this website not secure? ";"No because I am already most comfortable with Java."
"5ca18ea680a85";"3";"Junior";NULL;NULL;NULL;NULL
"5ca190e15a818";"1";"Junior";"Between tasks 2-3 I was overthinking the problems and tried solving them in unique ways. After that, I found them extremely easy";"Explanation of what each function did, and how to use it.";"As this is a study on programming language design, I think a study should be conducted with a programming language far different from standard convention. Java appears too similar to other languages and thus made it too easy to truly test the design of a programming language.";"Literally had zero effect honestly. Switching languages isn't difficult, I just overthought problems, but as I got near the end everything clicked."
"5ca1990f89439";"1";"Senior";NULL;NULL;NULL;NULL
"5ca3020cf22be";"2";"Junior";"none";"none";"Once I understood how preparing the query worked and studied the examples it was easy enough to figure out how to complete the tasks.";"no"
"5cacdddebbd91";"3";"Senior";"None ";"Not sure ";;"No "
"5cafb079ce414";"3";"Junior";NULL;NULL;NULL;NULL
"5cb0facd32c89";"2";"Senior";"The concepts weren't difficult to understand, realizing what I was actually doing wrong was the most difficult part.";"I don't believe so.";;"I did not feel like I had to switch between languages."
"5cb0fbe06e01f";"1";"Junior";NULL;NULL;NULL;NULL
"5cb2aa8d3bfb2";"0";"Junior";NULL;NULL;NULL;NULL
"5cb2d0eab913f";"2";"Junior";"I struggled on the 3rd task because I didn't realize that the syntax for sorting a table in a query is a 'ORDER BY' rather than 'SORTED BY'.";"I wouldn't capitalize the method names such as Prepare() or Search(). I found that to not be intuitive since I'm used to method names never being capitalized.";"I've completed these studies before and this iteration was definitely the most easy to learn and use. Great job to everyone who's working on this project!! :^)";"No, I did not feel like I needed to switch languages during the experiment. I think this increased my velocity while solving the tasks."
"5cb4e505db347";"1";"Senior";NULL;NULL;NULL;NULL
"5cb6175a9bdfb";"2";"Senior";"None";"No, the design of the programming language seemed adequate for the necessary tasks.";;"No, all the tasks seemed to be in Java."
"5cb6a546c0c22";"1";"Junior";"Combining the tables";"Have an ability to combine tables";;"No"
"5cb771be92b95";"3";"Senior";"Only issues I had was figuring out way MoreThan wasn't working only to remember GreaterThan was the proper way of stating the keyword.";"The text was very small and hard to read. I had to sit with my face right on the screen to read and type in my code. Maybe increasing the font size and adding color would help make the program user friendly. Also at one point I had an error that the program was vague about and only told me that I had an error not were it was or a hint on how to fix it. ";"Overall I enjoyed it because it felt like a puzzle game , just wish it was easier to read. ";"Not really if anything it just took me a second to focus on the fact that these were functions I would be playing around with."
"5cb790813133f";"3";"Junior";"Most of the concepts I found difficult. Such as constructing a table";"The directions could have been a little clearer";;"I stuck with C++"
"5cb7ae6c213f3";"2";"Junior";"Even though I've had experience with other programming languages, I've never worked with Query's before. I probably used them correctly in these challenges, but I still don't know what a Query is!";"I think it would've been nice if I could figure out what a Query is without any background knowledge.";"I feel like, in one challenge, I got the table wrong, but somehow it still got submitted and I was told that I completed the challenge successfully. I think there should be separate buttons for ""Check Code"" and ""Submit Code.""";"I did not feel like I had to switch between languages"
"5cb7af4a43479";"3";"Freshman";NULL;NULL;NULL;NULL
"5cb7ccd84898c";"3";"Junior";"I found it difficult trying to understand which objects to return.";"N/A";"N/A";"I did not think that I had to switch between languages. As the tasks progressed, the more I became familiar with the syntax of the language, which helped me solve the problems."
"5cb803c40c7bc";"1";"Graduate";"sometimes different tables need to interact with each other and might be a bit confusing.";"the tasks themselves are not tough (btw it seems like things would be easier if sql can be used...)";;"switch form different languages might need to change between different ways of thinking"
"5cb82871c9665";"1";"Senior";"The return of the null assumed returned object was a  0  not a null even though the code said it was null";"More clear explanations of the return of type objects and experiment error on part of the  proctor";"Question 2 displayed to me a  wrong description of a class object. The object  was ""students"" not  ""student"". It lead me to believe that my code had syntax errors  not type object errors even though the compiler was correct it returning  the error in question.";"No, I had adapted concepts and logic from one language  to apply to what was given to me. "
"5cb8b6bb216de";"2";"Junior";"none, it was pretty straightforward";"nothing, the programming language is pretty straighforward and easy to use";;"the way the objects are written makes it simple and easy to use, as long as there were examples. i think it helped my progress."
"5cb8b6b6563df";"3";"Senior";"Combine function was a little confusing. Didn't get why I need to query before making a table.";"Explanation of what the functions did and not just displaying the outputs with comments. Function usage information would help.";"I really hated that the provided code did not have an independent scrolling feature so it was time wasting to scroll from looking at that code then my code.";"No"
"5cb8c576d87ed";"1";"Junior";"The way combine worked was weird for the last task. One task we had to apply multiple filters for a table, but the different order I applied the filters made the results different? That was really confusing. ";"Not really";;"I thought it was all in the same language, so it was fine."
"5cb8d1602e611";"2";"Freshman";"Once i figured out what certain terms do, it wasn't too hard after that. 

Just plug and play from what I understand to do the study. Just follow the example. 

It got easier once i was towards the tasks at the end.";"I feel like it wasn't too bad of a programming language to learn. Now I only know C++ as a programming language, and I still consider myself a beginner when it comes to Computer Science, but I was able to follow and implement the language concepts the best I could.  ";"(TO MAKE THE STUDY A LITTLE EASIER FOR PEOPLE)

Scroll bar for the example program, Just for ease, when I did this study, I had to keep strolling up and down the main page and kept forgetting what I was looking at. If there was a scroll bar on the example problem rather than the whole page, then it'll be easier to do the problem. Basically comparing your program to the part you want to see without having to scroll down the main page would make it easier.";"I only know 1 programming language which is C++. So really, I was just comparing C++ to whatever we were doing earlier in the study. 

Knowing C++ helps with some of the processes that were happening in the study, even if some of them I haven't learned yet, or don't even know if they're in C++. But quite interesting to say the least."
"5cb8f23e620e1";"2";"Senior";NULL;NULL;NULL;NULL
"5cb939606490d";"1";"Junior";"The concept that I found difficult to understand was the merging of the charts table, where different requirements needed to be met.";"Not that I could think of";;"It didn't feel as though I had to switch between languages during the experiment. Everything in the syntax and semantics seemed intuitive and fluid."
"5cb98d3027490";"2";"Freshman";"I didn't understand the structure of the language, for example, I couldn't really get what a Query was. Maybe it was like an array ? In the examples, the only things that are shown look like some kind of built in functions that I can understand the purpose of, but not how they work or how to do anything without the given functions.";"Query seems to be a keyword for making something, but maybe having a more intuitive name to specify what it can/can't be used for ? Also, I was unsure what double quotes meant in the language, They seemed to be for synyax purposes/identifying, but I thought maybe it was a string? If its not a string, maybe use something other than "" .";;"I've only seen C++ before, so I didn't switch languages. If I did know more languages, I'm sure it would have helped."
"5cba027f50110";"0";"Freshman";NULL;NULL;NULL;NULL
"5cba22694faa4";"3";"Sophomore";NULL;NULL;NULL;NULL
"5cba2d2fe8f20";"3";"Junior";NULL;NULL;NULL;NULL
"5cba4d15171f4";"1";"Sophomore";"In the beginning, I needed more time to understand how the program is operating.
However, when I figure out how it works, it was actually easier than the first experiment.
If I can restart this research, I think I would be able to do everything.";"May need to comment on how the experiment output comes out without fixing anything.
For example
public Table query (Table students)
{ students.outputTable();}
so students can see how it will look like before it fixs.
";"It was giving me difficulty in the beginning. However, it was actually extremely fun after I figure out. 
I think this is a charming point of programming. Programmer having a tremendous of headache in the beginning and when they have so many errors, but feels full of happiness once it got solved.";"At first, the output data was giving me the errors in java. Therefore, I was very confused.
I was trying to use cout, if, and while statement in the beginning.
However, after I figure out how it works, I did not even have to switch between languages."
"5cbb567b260db";"2";"Junior";NULL;NULL;NULL;NULL
"5cbbff4d41ecd";"2";"Sophomore";"It wasn't that bad. I was confused at first because I've never seen that shit but it didn't take long to figure it out. I didn't finish one of them because I got bored at went for a snack lol.";"At first, it thought the prepare commands were actually a string because in C++ (the only language I really know) quotation marks indicate a string. That's about it";;"No, it was consistent"
"5cbc913b90946";"3";"Senior";"It all seemed pretty straight forward.  ";"No it was pretty straight forward.  ";"Allowing a scroll bar on the left side as well as the right side of the screen would have made looking at the examples easier.";"I felt like it was a database query using java.  Not switching of languages were necessary."
"5cbcb5b7450c9";"3";"Freshman";"I think the instructions were not clear for few of the tasks and I could not understand the last task at all.";"na";"the instructions should be more clear, and coding in the new language needs more explanation for new comers like myself who knows the only c++ language.";"I just applied what I knew through c++ and took little help from the sample although it was tricky to interpret."
"5cbcbf54745b9";"1";"Freshman";"Probably the most difficult thing to understand was how Queries are connected to the Tables. The interaction between the two ""variable"" types was confusing at first but then at 3d problem I started to see that Queries were used like filters for information intake into the tables.";"Switching = to == when comparing different things in Queries, the == feels more natural when comparing things and since you use != to check for none equality == would make more sense (to me). ";"I liked this language after I got used to it and the logic, I can see someone who is used to programming in this language being very quick at designing and manipulating data.";"I didnt feel the difference between the languages it seemed like just one data base language, this was good because I was able to get used to the language's logic so as I got farther into the problems its seemed more and more easy."
"5cbcd58e362b4";"2";"Senior";"The most difficult task was in the pop songs table, where I had wanted to make two tables and then combine them rather than use an ""or"" statement. I ultimately did try the ""or"" statement, but it was out of experimentation rather than intention, and I had no idea if my syntax would work for it.";"The arrangement of symbols around arguments, such as quotation marks on each line, or variation in how parentheses were input, were pretty confusing. Additionally, the compiler did not always make things particularly clear. In one phase, I was missing an argument with my syntax, but the compiler's error message made me believe there was an issue with the size or values of the strings being used in the task.";"I think it might be helpful in future studies to allow scrolling through the example and the task to be independent from each other, as I often found myself going back and forth, increasing task completion time between various double checkings.";"Yes, particularly in the use of key words. It made things slow to start out with, but once the syntax was recognized to be semantically the same as other languages, the tasks were easier to work with."
"5cbcdc67f197b";"0";"Sophomore";NULL;NULL;NULL;NULL
"5cbceacf89df1";"3";"Junior";NULL;NULL;NULL;NULL
"5cbd131912471";"1";"Freshman";"It was difficulty to understand why certain things worked or not. The compiler did not do a good job of explaining things.

";"I actually believe the language was pretty flexible and easy to use, I enjoyed it but the compiler was awful.";"A more useful compiler perhaps?";"No, I do not feel like I had to switch between languages. "
"5cbd578ae6627";"1";"Sophomore";"The full format of the 'table' and 'query'.";"No, I cannot think of anything that would have made these tasks easier.";;"I did not feel like I had to switch between languages. "
"5cbd6d3a0d8f9";"1";"Junior";"Using Filter was so hard that I finally figured out how to use it on the Question 5.";"I thought it would've been easier if the use of string on Filter and Replace were same. For Filter, I had to use ' ' this symbol but for Replace, I had to use "" "" so it took time to figure out how I could use them.";;"Yes, I felt like I had to switch between languages and it was so confusing because I usually use C++ language and it was not, so I had to force myself not to think about c++ ways."
"5cbddc3af041b";"3";"Graduate";"None of the concepts were particularly difficult, I had issues within the first 3 tasks, the first task I attempted to copy code from the sample section which ended up putting a line at the top of my program that was trying to load the sample data in my program, I didn't recognize this as the issue until time had run out. In the next two tasks, I had errors resulting from the library import stating that library.column could not be cast to a string column (task 2) and library.column could not be cast to integer column (task 3). I did not have these issues with the last 3 tasks.";"The language was fairly straight forward, I did not notice a method to combine table and I think that would have been useful.";"None";"I do not think it would be an issue if the languages were similar or the sample along side the tasks. "
"5cbddc4dd177a";"1";"Senior";"The differences between using an Update, Insert or Search functions, I find I still don't quite understand the differences when compiling, as function shows the new changes to the output. One of the questions I messed up was figuring out how to combine two filtered tables that were cloned from each other, while only keeping the data and leaving the filtering behind ( the music list question) I had some ideas with the combine function, but I soon found out it only takes certain variables from each table and make them equal to one another, or share the same the values (figured that out in upcoming questions).";"Besides describing Search, Insert, and Update a little more, this program felt alright. In terms of debugging, it was pretty fair in describing the errors, the logical errors were tough to find, but not impossible to debug. I understand that this language is still in development , but it would help out better to include coloring in keywords for visual help. There was also an issue of not seeing the contents of certain tables until you have to compile them. I had the confusion that we were suppose to create our own lists when one was already provided, but not visible to the programmer. If it's meant to be reading a from an external file than it's fine, but there should be tasks that include creating your own table of information.Other than that everything was OK.";"Just a little note. Some of the questions I wasn't able to turn in because I kept returning null when in debugging it said to return the table. in C++, I'm used to return 0 when compiling a file to tell the computer no errors were made, so I had the same assumption with return null. It would help to include the return in the example file, so as people can see the comparison.  Sadly it took me too long to notice the problem.

This study was pretty fun. It reminded me of a game called if else.Hearbreak, where you learn the developer's coding language called Sprak (Swedish translated:language) ,which was inspired from BASIC, that let you modify the data of objects in a 3D environment. 

I'm curious as to what was the inspiration to this language.

Lastly, I'd be happy to try out future studies to help further perfect this language.
";"I did switch between this language and c++, to which I felt this program was much simpler with having already built in functions to work with. Much of the assignment were manipulating outputs and dealing with data classes of information, which I felt comfortable for some of the questions. In terms of whether it affected my progress, it gave me some references when dealing with strings, integers, and assignment operators. But from the aspect of learning a new language, I heavily relied on the examples given from the start of the study, finding certain patterns that fit the criteria of the assignments, and then rewrite and combine certain code to see the affects. Regardless of my background with other languages, I'll admit, I was intimidated from the beginning, but I slowly understood the concepts. This process would have taken longer if I had no reference to coding whatsoever."
"5cbe114524b9b";"2";"Sophomore";NULL;NULL;NULL;NULL
"5cbe703d538d4";"3";"Sophomore";;;;
"5cbeab25eeff4";"2";"Sophomore";"Reading the errors and correcting them. ";"By the last question, I got a better feel for it and was able to complete the tasks. Overall, it was not difficult to figure out.";;"I only know one language so I didn't feel like I had to switch between languages and as a result that factor didn't affect my progress while solving the task. "
"5cbf7cd33d558";"3";"Sophomore";"In the beginning I didn't know I needed to return the Table by replacing null at the end of the code.";"After a little while everything made sense. I would change the length in which I needed to make single lines of code, I found the "".And"" cumbersome after so many times.";;"I did not feel like that. I feel as though I was using similar enough concepts that there wasn't any real separation in my mind between how I would code previously."
"5cbfa103b3e58";"2";"Senior";"The third task was not sure how to include all the list for songs by artisit ""Dude""";"no ";"Good for problem solving :D";"no "
"5cbfa968f137e";"0";"Senior";NULL;NULL;NULL;NULL
"5cbfd0250fdb6";"2";"Junior";"joining two lists together. ";"not writing the return statement automatically. ";"I liked the keywords, very intuitive. ";"not really, felt specific enough"
"5cc08de0863d2";"1";"Sophomore";NULL;NULL;NULL;NULL
"5cc12e138769d";"1";"Sophomore";NULL;NULL;NULL;NULL
"5cc13c370725f";"3";"Sophomore";NULL;NULL;NULL;NULL
"5cc15c8bd3aeb";"2";"Sophomore";"I just wasn't sure if I was doing it correctly. I ran the example that was given gave no errors. When I would do mine it gave me a lot of  errors so I wasn't sure what I was doing wrong";"yes, maybe explaining in detail the instructions. Soon all of the exercises it asked to give a table with said ID, name, last name and such so I just made up names. When I ran my code it said error, on all of it. So what I started doing was using the example that was given and changing minor things so see it I would get it correct. I don't think I did. ";"This was challenging for me, but it was okay because you really have to think outside the box. I do wish there was more explanation on how the code works, so in c++ you have your variables, int main, and function. I was not sure exactly if I was declaring the variable correctly if I didn't have to If I had to use functions or cout statements. I was not sure if I was doing it correctly. ";"Yes, I wanted to write it in c++ that's the only language I know but I knew that this was a study for a new language so I really wanted to give a try, I mean I had 6 tries. "
"5cc22b92c2b0a";"1";"Sophomore";NULL;NULL;NULL;NULL
"5cc3ad1e151d2";"3";"Freshman";NULL;NULL;NULL;NULL
"5cc3e1d1ec5d0";"1";"Junior";"The combine function was a little confusing.";"Nothing really. The programming language was pretty understandable from the get-go.";"I liked the straightforwardness of the programming language and how direct it is.";"No. Everything was very direct and easy to understand. It made it easier to remember all the functions and variables needed to accomplish the task. "
"5cc3fa588acc8";"3";"Senior";"I found that the whole syntax of learning a new language the hardest to understand. I already have very little programming experience, so trying to complete the tasks asked of me was really difficult. ";"Possibly to have more simpler examples of how to declare variables and what the syntax is to do so would be. ";"The test was difficult for me. Even if the test was in C++ I would not have been able to solve most of the questions as I am still a beginner in programming. ";"I constantly felt like I had to use c++ as a language simply because its the only programming language I knew and it made sense to me. "
"5cc47d24d6a61";"2";"Freshman";"I realized that I do not have a strong knowledge of java as I previously thought that I did. ";"I wish there was the color coded text editor that would help me distinguish between variables, functions, etc.
";;"I am stronger in C++, so I would often code in C++ and change it into java."
"5cc4a471147f0";"3";"Junior";"The entire thing.. I unfortunately couldn't code or understand the problem because I was fixated on the fact that I could not code it in Java. ";"Yes, give the participant a clear ability to choose the language that they would like to use to solve the problem in the given amount of time.";"Thank you for generating this study. It allowed me to see my own shortcomings. :)";"You could switch between languages!?!?!?!?!?"
