"uuid";"lang";"year";"concepts";"design";"comments";"codeswitch"
"5c75b3df83786";"1";"Not Applicable";"1) Finding where the question was given to me at first - once I found it/knew where it was, it was fine from there on.
2) Whether or not I had to re-write the function definition as part of my answer or not, after a few questions though it became clear that I did not have to.
3) Understanding American schooling system terminology and cross-referencing the classes I had taken to the ones listed";"1) Some of the uses of quotes and double quotes were, to me, not usual. E.g. I would have expected something like xx.AddFields(""firstname, lastname, age""); to be xx.AddFields(""firstname"", ""lastname"", ""age"");
2) The at one point I wanted to put brackets around some logic statements, but this caused an error in the compiler. E.g. Something like this xx.Filter(""(condition1 AND condition2) OR condition3"");
";"Once I had completed the first 3 tasks, I noticed that all the tasks had the same sort of approach to solving them: find the matching task in the source code, copy it, change identifiers, return the table instead of outputting it. I do not know if this was intended as part of the study or not, but thought you should know.";"I don't feel that I had to switch languages DURING the tasks, but the 'language' that was used was not familiar to me. At first the syntax of the language was slightly difficult to understand, but once I understood it the tasks became a lot easier - this will probably explain why it took me longer to progress with the first task compared to the last."
"5c75befde5bf8";"2";"Junior";NULL;NULL;NULL;NULL
"5c767c7678499";"1";"Professional";"Compiler error caused by non-printable unicode character I copied from the example code to the task code.";"The SQL language could have been actually typed and a proper part of the programming language like C#'s Linc is.";"I'd be interested in the results of a similar study switching back and forth between OOP and Functional programming.";"Sure. I had to switch between an object oriented language and a set based query language.
One was typed, the other ""stringly"" typed.
It a switch, but after nearly a decade of experience and a dozen languages on under my belt, it's a minor switch.
My day job has me routinely going from C# and UI work all the way down to C and embedded software in the same task though, so I may not be representative."
"5c76e66818d7e";"3";"Junior";NULL;NULL;NULL;NULL
"5c77544a3ff11";"3";"Sophomore";"Formatting the chain of filters.";"Not that I can think of.";"The programming text box is entirely broken. In order to actually get code to run and be editable, I had to:

1.) copy the template into a separate vim window
2.) enter the developer tools and inspect the element containing code
3.) completely remove all line elements, leaving only the parent code element
4.) paste code
5.) run code

Trying to tab around would randomly jump around code and trying to copy+paste code would strangely copy the entire code input textbox into itself. Most of my time for the first problem was not spent on the study itself but forcing the survey to actually function. Due to this, I think it may be in the experimenters best interest to test the editor in more programs and ignore my submission despite having completed all tasks successfully.";"I did not switch between languages. All code was figured out just by the wording of the functions and surrounding code."
"5c783bc1d5b9c";"3";"Senior";"I did not find any of the concepts difficult. Once I understood the layout it was simple. Only problem with the first one was that I did not read correctly what to return.";"Not that I could think of.";"None";"I do not think it affected my progress. I did not have to switch between languages."
"5c797b0b9835a";"2";"Sophomore";"all";"not sure";"better directions?";"didnt know what was going on"
"5c79adf5a4ad1";"3";"Professional";"the most shady part was the left-associativity of .And/.Or methods";"it's hard to make any sense of the language after such a short ORM-y sample; it surely sucks, as anything similar to Java/C++ does -- these are languages to manage people, not to do the computations.
of the ORM design, the join metaphor feels tricky if some field names collide; also the and/or operators seem horrible (perhaps it would be nicer to treat queries as sets of requirements and have query-combinators to build larger ones of these? and then one could have negations as well). last thing, this search/filter syntax is disgusting, as one cannot use a chain of method calls,the query needs to be names which misses the point.

btw the syntax having semicolons is hilarious; they were introduced in 60s because it was easier to implement parsers (at most 1 token lookahead -- save the RAM!).
also the convention of naming variables with type, say Query somethingQuery -- disgusting, but that's not the language itself. I switched to calling this thing q as there was no other query. if I could (i didn't find out how as the study does not allow to refactor the solution) i'd use point-free style all the way, why should i name any construct that is a temporary construction?";"i hope this study is about obsolete and horrible tech, not anything having to do with future languages;
of course there are absolutely brilliant languages for querying data, SQL (the syntax sucks but at least is consistent), prolog (no negations, but check out mercury/godel), KANREN family, and for many many tasks just apl-like point-free stuff.

i hated this study with all my heart, i did it because i appreciate science and i realize how hard it is to find volunteers.
all best, dear stranger form the internet!
";"no"
"5c7a21c41d7be";"2";"Professional";"None";"No";"Task4, Task5 phrasing errors
* Please write this method to return the Table object student with an entry
* changed.

This should read 'Table object students' not Table object student";"yes, java to SQL and back.
Minimal."
"5c7adedc43403";"1";"Sophomore";NULL;NULL;NULL;NULL
"5c7af3301a4c7";"1";"Professional";"None.";"No.";"I am a curious person, and I would like to understand more about the study, because I am interested in these kind of topics. However, I feel like after clicking ""I'm finised"" no further information that help me to learn more about it will be provided. So the question is: Can you reveal more about the study? If so, can you send me an email? My email is <redacted>.
On the other hand, even though the ""quality"" of this website might not have been the priority, and the focus is on what the subject ends up coding, I feel like I could have been more efficient if the editor worked well. For example, I am used to copy and paste, and move things around. Some people might blame at me, because I am copying and pasting!, but when I wanted to add the fields to a query, I would rather copy and paste directly from the table schema that was shown than typing field names one by one, and the reason for this is I was dealing with ""untyped"" queries, meaning that a typo will show up at runtime most likely.";"I did not feel like I had to switch between languages. C# is my primary language, and I believe the study was using Java, and the basic stuff of Java, so I had no need to do a ""mental conversion"" from C# to Java. But even if the study's language would have been different to C#, I think I would not have to do any mental conversion at all, as I usually try to think in terms of the programming language I am working with."
"5c7bcc2bc0933";"2";"Professional";"None";"If the SQL library could issue a warning when it detects the programmer is using the wrong operator in the context of their query, e.g. double- instead of single-equals for an equality comparison.";;"I did feel like I had to switch between languages during the experiment. I used the ""double-equals"" (==) equality comparison operator from Java in an SQL query without thinking about it and that turned out to be the source of an erroneous result."
"5c7e748f3735f";"3";"Professional";"There seemed to be an implicit ordering similar to English in some of the boolean/query predicates, which presented some difficulties when coming from a background of experience in other systems and programming languages.";"Documentation.";;"No; however, the implicit ordering of predicates in one of the tasks was confusing: although read from left-to-right in the same way as expressed in English in the task description, had a different meaning when expressed in other programming languages I'm familiar with. There seemed to also be no way to chain table queries together."
"5c7ed6c28c85c";"2";"Junior";NULL;NULL;NULL;NULL
"5c7f131a55887";"0";"Professional";NULL;NULL;NULL;NULL
"5c7f68ffcb0b8";"3";"Sophomore";NULL;NULL;NULL;NULL
"5c816968e4a8d";"1";"Senior";NULL;NULL;NULL;NULL
"5c82d8d6be5a0";"0";"Junior";NULL;NULL;NULL;NULL
"5c84340aea202";"3";"Junior";;;;
"5c86c19fd20a3";"2";"Sophomore";NULL;NULL;NULL;NULL
"5c8886ac3e3d9";"1";"Junior";"The Table class took some getting used to.";"Not really. Pretty well made class.";;"I didn't feel like I had to switch between programming languages."
"5c8aff70f29b2";"3";"Senior";"The combine on the last question.";"A few more descriptions on the function calls.";"Was fun.";"No. It wasn't bad using Java."
"5c8b294b7c9d3";"2";"Senior";"how we could choose ""attributes"" ";;;"no.
"
"5c8d2d6def4d4";"1";"Senior";"It was difficult to understand that the query is name before the filtering is done.";"Maybe make separate section for the different query examples.";;"I did not think I had to switch between languages."
"5c8d78ff3963d";"2";"Junior";NULL;NULL;NULL;NULL
"5c8f29b1df3b4";"1";"Freshman";"I think the first few were the most difficult (filtering) because I have never been exposed to that kind of code before. It took me a while to get used to the syntax. ";"I think after getting used to the language, it is very straightforward and easy to understand. ";"I thought the experiment was well put together and had enough information for people to understand the language. ";"I thought I had to switch between languages during the experiment (the one we used and c++). I sometimes thought it was valid to use c++ syntax because I was not sure if it was the same syntax or not. Since I did this, I could not do the first few tasks since I was using &&, when the actual answer just needed ""and."" "
"5c8fb9eb5ba59";"3";"Senior";"Nothing. The tasks were easy in theory (ie: in another language), but this unfamiliar language made it difficult in practice.";;"The text editor is very poor, it always pastes into a new line unindented and will never overwrite.";"Yes. It would be much easier if the Table and Query classes were able to accept the += operator."
"5c900967afb31";"3";"Junior";"I had the most trouble initially understanding the concepts of creating a new query. I was confused as to why I had to create a new query and how that query object was able to gain access to the Table objects (but I was able to understand about 2-3 tasks in). Besides that, nothing else seemed too difficult. ";"I can't really think of anything. The programming language itself was clear and readable. Besides the first task, I believe I was able to solve the rest of the tasks. ";"The experiment was enjoyable! Even though I seriously didn't expect it to take me 2 hours (which it did) and I didn't expect it to frustrate me (which it did but just once and slightly), I had a lot of fun! In terms of feedback, I feel that it would be more efficient IF it were possible to be able to scroll down on the sample code SEPARATELY from the actual code I am writing. There were many instances where I had to scroll down to look at the sample code, but it would scroll down the whole page causing me to scroll up and down to look at my code and the sample code. As a result, I would lose track of what I was trying to find. (but it wasn't a huge deal) ";"I never really felt this sense of ""switching"" between languages throughout the experiment. I am most familiar with C++ and I was familiar with object orientated programming so completing the the tasks was manageable. I feel that if someone has had experience with object oriented programming, then they shouldn't feel a huge shift of languages since each task involved calling methods to perform tasks. "
"5c903c3701f4c";"1";"Sophomore";"Combining two tables into one";"a basic syntrax guide and what other functions are available ";;"it did, since SQL code is not exaclty the same and the full code/ functions are not showing as well"
"5c918c20c55c9";"1";"Senior";"none, very straight-forward. Excellent comments!";"This language was easy to pick up. Only issue I had was using '==' instead of '='. That's why I'm used to though.";;"Not really, I found this syntax very similar to what I'm used to. Although, I did get stuck on one task for a couple of minutes because of not using '=' and instead I used '==' naturally. I had the idea right to begin with but I thought I had an error somewhere else so wasted 5 minutes on that changing other things that had nothing wrong with it. "
"5c91b74420925";"2";"Senior";NULL;NULL;NULL;NULL
"5c92e3712bc24";"3";"Senior";NULL;NULL;NULL;NULL
"5c93185eba537";"1";"Junior";"Actually updating the table to take out a field from the list.";"No after the initial understanding of what the programming language actually did, it was pretty straightforward on how to do things with the language. ";;"No, it felt like using a language I was already familiar with. This definitely helped in solving the problems as each question came by. "
"5c93af03e551c";"2";"Senior";"Not obvious in the one test that there was an option to use 'or' when querying ";"The different between """" and '' in the queries was not really intuitive. And I dont like using '=' instead of '==' to compare strings.";;"The language use felt consistent the entire way through. It made each task easier because they followed the same format."
"5c958343f1e77";"2";"Sophomore";"Initially, understanding what was expected was a bit confusing, because I didn't see the instructions for the first coding assignment right away.  It took about a minute to realize that the instructions were written in the comments of the program where I had to write code based on the sample code provided.  Also, for the most part, I was unfamiliar with the programming language that I had to write in, though it did seem like it may have been an query language of some sort. Last, during the phase in the experiment where we had to look at the sample code before we were given our first task, it was initially a bit daunting because I did not understand what any of the code was doing.  This became much clearer after going through each coding exercise.";"I do not believe so.  As stated above, by the third coding exercise, the syntax for this language was much clearer and that made it easier to complete the remaining tasks. ";"Although it started out as a daunting task, I started to enjoy the process of completing each coding exercise and welcomed the challenge of debugging the code I wrote when if it didn't compile correctly the first time.  This was an interesting experience!";"No, though this is primarily because I wouldn't have known how to convert what I was seeing to a language I was familiar with.  I had to look at what I was being asked to do, look at the sample to see a comparable example based on the task it implemented, and go from there.  At the start, trying to perform the required task in an unfamiliar language took quite a bit of time.  However, by the time I was on the third coding exercise, I had a much better understanding of how the code I was writing actually worked and was even able to type out some of the code without looking at the sample.  This enabled me to complete the remaining tasks at a much faster rate of time."
"5c95a3d580e59";"2";"Junior";"At first, I found it difficult to understand how to use the different methods for filtering data.";"Immediately seeing the data I was working with at the start of each task would've made the tasks easier to me. ";"I really appreciated this experiment because I have never participated in one before. I believe I better understand my programming and comprehension skills with the current knowledge I have. Knowing only C++ though school, I am encouraged to learn more programming languages on my own.";"I did not feel like I had to switch between languages during the experiment because I have never seen or worked with this language before. To be honest, I still don't know what language it was. I do not think it affected my progress very much because it was entirely new to me, so I could only compare it to the only language I am proficient in (C++)."
"5c96d03544708";"3";"Sophomore";"Nothing. It is quite comprehensible. ";"No. It has its own beauty.";"I was bamboozled that the opposite term of ""LessThan"" was ""GreaterThan"" instead of ""MoreThan."" ";"No. Java is surprisingly similar to C++."
"5c97e774c9aa2";"3";"Junior";"I felt little bit confused with the grammar at beginning but getting more familiar after couple tests.";;;
"5c986742ca193";"1";"Sophomore";"Trying to learn a programming language I've never used before and solve a problem with it seemed really hard and having 5 minutes with the code before seemed like not enough at first.";"Accessing elements seemed hard at first but I felt that the programming language could not have made it easier";;"No because getting a basic grasp of the language came quickly after 1 or 2 tasks. "
"5c99b6d151e2a";"1";"Senior";"Generally, learning a language on the fly was pretty difficult. More specifically I couldn't figure out how to get Dude back into the table in question 3 after filtering him out.";"No, not really. The code was pretty easy to understand.";;"Yes, basically I had to translate the example code to English to understand what was going on. This takes a lot of time, and of course ""mistranslations"" can occur. If I had prior experience with this language, no translations would have been necessary."
"5c9ad1f80293a";"2";"Senior";"Most. I did not understand how to complete the tasks asked.";"N/a";"n/a";"Not necessarily. I am having trouble understanding a high level language already"
"5c9bf66bda683";"3";"Senior";NULL;NULL;NULL;NULL
"5c9bfd9188ead";"3";"Professional";"None of it was difficult.";"A clearer structure for logic would've been nice. I.e. the difference between (X AND Y OR Z) and ((X AND Y) OR Z) seems a little obscure with the given methods.";;"It felt to me as though I was using the same language throughout."
"5c9e574b8c1a4";"1";"Junior";NULL;NULL;NULL;NULL
"5c9e72cc7c743";"1";"Senior";"The API for the Combine query wasn't very intuitive right away. In the Combine query you pass the tables into the query.Combine([table1], ..., [table2], ...), but then later you have to call [table1].Search(query). This is confusing because the Search method intuitively assumes that it will be searching [table1]. For example, is there a difference if I called [table2].Search(query). I have no idea, and this makes it confusing.";"Regarding the problem I pointed out in my first answer, here's how I would change the language to mitigate it. Instead of having the Combine method in the Query class, put the Combine method in the Table class. Then if I want to combine tables, I simply put

Table carsAndTickers = cars.Combine(tickets, ""[the 'id' that matches in both tables to merge rows]"", ""[the fields I want in the name table separated by commas]"");

To me this is less ambiguous, and now you can call carsAndTickers.Search without ambiguity about which Table that query will be searching.";;"No. I was familiar with Java before hand, and the API syntax was mostly intuitive to the point where for some of the problems I barely had to look at the sample code."
"5c9e8a1e9bcc6";"1";"Sophomore";"-Using multiple logic operators in a query filter
-Not being able to use query filters on newly constructed tables (at least, I couldn't get it to work)
-Didn't realize return had to be changed from NULL for a while";"If I were able to perform query operations on tables created through query operations (i.e. In Task 2, Table schmidtTable = students.Search(SchmidtQuery) would lead into Table gradeTable = schmidtTable.Search(GradeQuery)), I feel I could have solved some of the tasks easier.";"It would have been nice to go back and optimize code in the tasks after getting confirmation that it produces the desired results.
Also, some tasks seemed to accept tables returned with more fields than were requested, not sure if that was intentional...";"I did not feel like I had to change between languages for this experiment. Because of this, as I familiarized myself with the language in the first three task, I was able to complete the latter three tasks quickly and in one try."
"5c9f91d3e39c1";"2";"Senior";"At the beginning, I had trouble understanding what each step was doing. After the a couple times doing things on my own, and seeing the results, I started to understand.";"I think that the language could have made the process of combining multiple checks stand out more. When you were making a table where you were checking for multiple things, you would do:
name = 'Ann' and grade = 'A'
I feel that the and should be in all caps similar to all the other things .";;"I did not feel like I had to switch between languages, so I think my progress while solving the tasks was helped. Once I understood what each line was doing, I could easily figure out what to do and which code samples would be beneficial."
"5c9fdeffb4f8f";"1";"Not Applicable";NULL;NULL;NULL;NULL
"5c9ff3c133107";"1";"Junior";"What terms such as ""Query"" stood for in the context of the code. It was also difficult trying to find out how to remove something from a table via updating.";"Not that I can tell, I dont have much experience with programming languages.";"N/A";"I did not feel like I had switch because I don't have much experience in other languages, so it was like going over a new language by myself."
"5ca00fcbbef78";"2";"Sophomore";NULL;NULL;NULL;NULL
"5ca03cf549454";"3";"Senior";"the Null return error. It was not clear.";"Yes. The language design was easier to accomplish the task. ";;"yes. at some point i would like to switch to the language i am familiar with."
"5ca0eb1eb27d9";"2";"Junior";"It's been a while since I used SQL (about a year or two) - and I primarily used T-SQL, not PL-SQL. The concept of querying made sense, but containing the queries in functions/methods was brand new to me. ";"The addition of an ""OR"" into the language for the third or fourth query (don't remember which one) - or just allowing us to use two WHERE's. The insertion method that we had been provided only allowed us to insert values and not tables. Because we didn't know the contents of the ""Dude"" query, we couldn't just append the first query with the values that the question was looking for. ";"I had to restudy the syntax for the first few questions, but towards the end I knew what I was looking for. Towards the end, I ended up just cutting and pasting the sample code and editing the values to match what I needed. ";"I didn't feel like I had to switch between languages. Some of the syntax reminded me of C++, but other than that it all felt pretty self contained."
"5ca14eb349da3";"3";"Sophomore";"None of the concepts were difficult to grasp.";"Working on a dedicated text editor rather than using the text boxes on this website. I sometimes used keyboard shortcuts which the text box did not agree with. ";;"Writing pseudocode to perform some of the tasks, I found myself writing c++ solutions rather than the given language. The process helped me understand the task at hand, acting as a base for translating the c++ instructions into the experiment's language."
"5ca15409b7afc";"3";"Junior";NULL;NULL;NULL;NULL
"5ca154385c12a";"3";"Junior";NULL;NULL;NULL;NULL
"5ca157cb568c3";"1";"Junior";"how to add multiple filters to the query to produce desired results.";"An example with multiple filters in the sample code would have made the first three tasks easier for me.";"None. ";"No. "
"5ca1618b47e8e";"2";"Junior";"It was difficult to switch to different tasks back to back. I had to take a large chunk of time to rework the problem.";"The large amount of assignments causes fatigue and I made less progress on the later ones. Cutting the assignments to 3.";"Try giving prep time before every assignment, not just the first.";"I only used C++."
"5ca16a7e8a4ff";"1";"Junior";"I found that the idea of filtering out certain dates/grades/etc. was kind of confusing. At first I had the idea of ""oh i'll just use the filter function one at a time on every requirement the prompt is asking"", but then I realized using that function wasn't working. Then I noticed in the sample code that the method I was thinking of was never actually performed. Instead, all that was necessary was inputting the ""and"" keyword into the filter function. One thing I also noticed was that I wasn't sure of how to add ""Dude"" to the table, because ""or"" was never shown to be possible in the sample code. I could be wrong, but I just didn't see it. Thankfully I tried it out because my other attempts were failing me.";"It was probably just me but at first I was confused by the Filter function, because I assumed you had to filter out one thing at a time, for some reason it didn't click in my head when I saw the filter with the ""and"" keyword. Other than that, I felt like the language was pretty solid.";;"I didn't necessarily have to switch languages, but I did think of things in terms of if statements a little bit, but I never actually tried to implement anything in other code. I think thinking in terms of conditionals kind of helped me out, but that wasn't exactly a language specific thing, more so a general concept. "
